{"alternative_hypotheses":["The fictional observation may reflect a benign artifact."],"assumptions":["The two fictional primary records are independent."],"claim_mode":"REPORTED_CLAIM","claim_reference":{"claim_id":"CLM-FIW-FIXTURE-READY","claim_mode":"REPORTED_CLAIM"},"decision_conditions":{"stop_conditions":["Stop if exact source bytes change."]},"decision_context":{"consequence":"MODERATE","reversibility":"REVERSIBLE"},"evidence_references":["SRC-FIXTURE-A","SRC-FIXTURE-B"],"evidence_state":{"expires_at":"2027-12-31T23:59:59Z","strength":"STRONG"},"inference":["The fictional fixture may proceed to bounded human review."],"metadata":{"assessment_id":"PIA-FIW-FIXTURE-READY","case_id":"FIW-FIXTURE-READY","synthetic":true},"observation":["The fictional fixture contains a declared observation."],"public_boundary":{"contains_sensitive_data":false,"public_release_allowed":true},"review_requirements":{"decision_owner":"Synthetic Review Board","human_review_required":true},"salience":"MEDIUM","source_lineage":[{"parent_id":null,"relationship":"PRIMARY","source_id":"SRC-FIXTURE-A"},{"parent_id":null,"relationship":"PRIMARY","source_id":"SRC-FIXTURE-B"}],"subject":{"title":"Fictional schema and runtime parity fixture"}}
