{"alternative_hypotheses":["The fictional measurement may reflect a benign artifact."],"assumptions":["The fictional source records are internally consistent."],"claim_mode":"REPORTED_CLAIM","claim_reference":{"claim_id":"CLM-FIW-SYN-003","claim_mode":"REPORTED_CLAIM"},"decision_conditions":{"stop_conditions":["Stop if source identity or exact bytes cannot be verified."]},"decision_context":{"consequence":"MODERATE","reversibility":"IRREVERSIBLE"},"evidence_references":["SRC-FIW-SYN-003-A","SRC-FIW-SYN-003-B"],"evidence_state":{"expires_at":"2027-12-31T23:59:59Z","strength":"WEAK"},"inference":["The fictional measurement may support a bounded human review."],"metadata":{"assessment_id":"PIA-FIW-SYN-003","case_id":"FIW-SYN-003","synthetic":true},"observation":["The fictional record contains a declared measurement."],"public_boundary":{"contains_sensitive_data":false,"public_release_allowed":true},"review_requirements":{"decision_owner":"Synthetic Review Board","human_review_required":true},"salience":"MEDIUM","source_lineage":[{"parent_id":null,"relationship":"PRIMARY","source_id":"SRC-FIW-SYN-003-A"},{"parent_id":null,"relationship":"PRIMARY","source_id":"SRC-FIW-SYN-003-B"}],"subject":{"title":"Fictional Perception Integrity demonstration FIW-SYN-003"}}
